{
  "recordKind": "hacp.v0_3_candidate.stop_response",
  "schemaVersion": "hacp-0.3-candidate",
  "stopId": "stop_example_pre_start_001",
  "packetId": "taskpkt_example_pre_start_stop_001",
  "decisionId": "decision_example_stop_authority_basis_001",
  "profileId": "hacp-accountable-continuation-v0.3-candidate",
  "successorInvocationId": "invoke_example_stopped_worker_001",
  "stopReason": "MISSING_AUTHORITY",
  "whatDoesNotLineUp": "The presented decision did not have a readable accepted consumption receipt for this successor invocation.",
  "evidenceRefs": [
    "evidence://example/receipt-lookup-empty"
  ],
  "minimalCorrection": "Return to the human decision gate or verify authentic issuer-side admission and current validity under an approved continuation profile; a claimant-created receipt is insufficient.",
  "successorWorkBegan": false,
  "boundaryStatement": "The stop records a candidate no-start assertion for this invocation; it does not prove execution absence outside the declared evidence boundary.",
  "digest": {
    "algorithm": "sha256",
    "canonicalization": "json-rfc8785-jcs",
    "digestDomain": "io.hacp.stop-response.v0.3-candidate",
    "value": "64a590fc29e8e0969771dbfeab58d3b59bf9bcfdab8a338cccd10ea826a8745e"
  }
}
